id;fpath;sentence;remove_start;remove_end;removed;type;short_sent;cons_score;ual;la;removetype;sentence_analysis_data;peasona;verb
72354;Train/aja_pm20000218_osa_5_ud211.conllu;Kuigi Tallinna politseiprefektuuri majanduskuritegude uurija lõpetas eile hommikul oma määrusega Annika Jürgensoni ( 23 ) vastu kelmuse paragrahvi alusel algatatud kriminaalasja kuriteokoosseisu puudumise tõttu , tühistas prokurör Tõnismägi selle juba eile pärastlõunal .;128;146;kelmuse paragrahvi;bound;Kuigi Tallinna politseiprefektuuri majanduskuritegude uurija lõpetas eile hommikul oma määrusega Annika Jürgensoni ( 23 ) vastu alusel algatatud kriminaalasja kuriteokoosseisu puudumise tõttu , tühistas prokurör Tõnismägi selle juba eile pärastlõunal .;80.6;80.6;96.8;no;('kelmuse', 16, 18, 'lõpetas', 6);kelmuse;lõpetas
72494;Train/aja_pm20001004_osa_3_ud211.conllu;Linnavalitsuse mitme allika sõnul on mõlemad mehed oma läinudnädalasest ootamatust haigushoost tervenenud ja said kätte vallandamisteatised , ent ametlik kinnitus sellele puudub .;0;27;Linnavalitsuse mitme allika;bound;sõnul on mõlemad mehed oma läinudnädalasest ootamatust haigushoost tervenenud ja said kätte vallandamisteatised , ent ametlik kinnitus sellele puudub .;95.0;95.0;95.0;no;('Linnavalitsuse', 0, 3, 'tervenenud', 12);Linnavalitsuse;tervenenud
72847;Train/tea_dr8047.conllu;Erialases kirjanduses osutusid uurimistulemused kanamunade ja kana-broileriliha rikastamiseks ω-3-rasvhapetega tihti vastuolulisteks .;48;79;kanamunade ja kana-broileriliha;bound;Erialases kirjanduses osutusid uurimistulemused rikastamiseks ω-3-rasvhapetega tihti vastuolulisteks .;88.9;88.9;88.9;no;('kana-broileriliha', 6, 5, 'osutusid', 3);kana-broileriliha;osutusid
72326;Train/aja_pm20001004_osa_1_ud211.conllu;Tänu avanenud võimalustele pääseda Stockholmi Kuningliku Raamatukogu ja Uppsala ülikooli raamatukogu fondidesse on meie senised teadmised Academia Gustaviana väljaannete kohta täienenud ning ülikool on saanud sealt koopiaid .;72;79;Uppsala;bound;Tänu avanenud võimalustele pääseda Stockholmi Kuningliku Raamatukogu ja ülikooli raamatukogu fondidesse on meie senised teadmised Academia Gustaviana väljaannete kohta täienenud ning ülikool on saanud sealt koopiaid .;96.3;96.3;96.3;no;('Uppsala', 8, 10, 'pääseda', 4);Uppsala;pääseda
73117;Train/tea_eesti_arst_2004_osa_2_ud211.conllu;Kliiniliselt esineb progresseeruv düspnoe , köha , mõnikord ka veriköha , mis on bronhoskopeerimise näidustuseks ja soodustab haiguse avastamist .;81;99;bronhoskopeerimise;bound;Kliiniliselt esineb progresseeruv düspnoe , köha , mõnikord ka veriköha , mis on näidustuseks ja soodustab haiguse avastamist .;100.0;100.0;100.0;no;('bronhoskopeerimise', 13, 15, 'esineb', 2);bronhoskopeerimise;esineb
74198;Train/tea_dr8047.conllu;On leitud , et südame-veresoonkonna haiguste ennetamiseks on vajalik igas riigis vastav riiklik programm , kuna südamehaigused ei ole mitte üksnes meditsiini probleem , vaid nad sõltuvad eluviisist , toitumisest , psühholoogilisest kliimast tööl ja paljudest teistest faktoritest .;15;44;südame-veresoonkonna haiguste;bound;On leitud , et ennetamiseks on vajalik igas riigis vastav riiklik programm , kuna südamehaigused ei ole mitte üksnes meditsiini probleem , vaid nad sõltuvad eluviisist , toitumisest , psühholoogilisest kliimast tööl ja paljudest teistest faktoritest .;94.6;94.6;100.0;no;('südame-veresoonkonna', 4, 6, 'leitud', 2);südame-veresoonkonna;leitud
72995;Train/aja_ml200247_osa_2_ud211.conllu;Põllumeeste meelest on meeldiv seegi , et raha ei pea kohe välja käima , vaid see arvestatakse tasaarvelduse korras piimarahast maha .;95;108;tasaarvelduse;bound;Põllumeeste meelest on meeldiv seegi , et raha ei pea kohe välja käima , vaid see arvestatakse korras piimarahast maha .;85.7;95.2;85.7;no;('tasaarvelduse', 17, 19, 'arvestatakse', 17);tasaarvelduse;arvestatakse
73036;Train/aja_pm20001004_osa_1_ud211.conllu;Tartu linnavalitsus tunnistas eile bussifirma Liikor erastamise nurjunuks , kuid ei otsustanud ettevõtte saatust .;35;52;bussifirma Liikor;bound;Tartu linnavalitsus tunnistas eile erastamise nurjunuks , kuid ei otsustanud ettevõtte saatust .;100.0;100.0;100.0;no;('Liikor', 5, 5, 'tunnistas', 3);Liikor;tunnistas
72907;Dev/aja_ee199920_osa4_ud211.conllu;Oulus elav Helsingi ülikooli kirjandusprofessor Kari Sallamaa pani etnofuturismi juubeliürituse lõpus Rõuges kõigile südamele , et me kirjutaks , kirjutaks ja kirjutaks ja levitaks etnofuturismi rõõmusõnumit igale poole .;11;19;Helsingi;bound;Oulus elav ülikooli kirjandusprofessor Kari Sallamaa pani etnofuturismi juubeliürituse lõpus Rõuges kõigile südamele , et me kirjutaks , kirjutaks ja kirjutaks ja levitaks etnofuturismi rõõmusõnumit igale poole .;92.9;92.9;92.9;no;('Helsingi', 2, 4, 'pani', 8);Helsingi;pani
72470;Train/tea_AA_05_6_ud211.conllu;Projekti tulemuste valideerimiseks kasutatakse ja arendatakse edasi VALNET projekti raames väljatöötatud meetodeid .;0;18;Projekti tulemuste;bound;valideerimiseks kasutatakse ja arendatakse edasi VALNET projekti raames väljatöötatud meetodeid .;100.0;100.0;100.0;no;('Projekti', 0, 2, 'kasutatakse', 4);Projekti;kasutatakse
74392;Train/tea_geofyysika.conllu;Viimasel ajal on üles kerkinud küsimus väikese massiga ja maapinnalt nähtamatute komeedilaadse päritoluga objektide võimalikust suhteliselt sagedasest langemisest Maa atmosfäari .;39;177;väikese massiga ja maapinnalt nähtamatute komeedilaadse päritoluga objektide võimalikust suhteliselt sagedasest langemisest Maa atmosfäari;bound;Viimasel ajal on üles kerkinud küsimus .;100.0;100.0;100.0;no;('langemisest', 17, 6, 'kerkinud', 5);langemisest;kerkinud
73418;Train/aja_luup200106_osa_1_ud211.conllu;Eesti pangamiljonäri investeerimiskäitumine erineb järsult USA miljonäri omast .;0;20;Eesti pangamiljonäri;bound;investeerimiskäitumine erineb järsult USA miljonäri omast .;100.0;100.0;100.0;no;('Eesti', 0, 2, 'erineb', 4);Eesti;erineb
74541;Train/ilu_vilep_ud211.conllu;Sõitnud veel ühe täisringi linnale peale , läks ta oma ukraina-kodu lähedal maha , lonkis majade vahel ja otsustas siis , et täis kõhuga sujuvad asjad paremini .;51;54;oma;bound;Sõitnud veel ühe täisringi linnale peale , läks ta ukraina-kodu lähedal maha , lonkis majade vahel ja otsustas siis , et täis kõhuga sujuvad asjad paremini .;96.3;100.0;96.3;no;('oma', 9, 11, 'läks', 8);oma;läks
72347;Train/aja_ee200110_osa_8_ud211.conllu;PäRAST NäITUST LUGESIN keha-annetajate häälekandjast erinevaid vastuseid sellele küsimusele .;23;38;keha-annetajate;bound;PäRAST NäITUST LUGESIN häälekandjast erinevaid vastuseid sellele küsimusele .;100.0;100.0;100.0;no;('keha-annetajate', 3, 5, 'LUGESIN', 3);keha-annetajate;LUGESIN
74462;Train/tea_toohoive.conllu;Reformid on sätestanud palkade mõõdukamaks tegemise , tulumaksu kärped , töötu abirahade kitsendamine ja osalise tööaja barjääride vähendamise ( Tille 2001 ) .;105;119;osalise tööaja;bound;Reformid on sätestanud palkade mõõdukamaks tegemise , tulumaksu kärped , töötu abirahade kitsendamine ja barjääride vähendamise ( Tille 2001 ) .;100.0;100.0;100.0;no;('osalise', 14, 16, 'sätestanud', 3);osalise;sätestanud
72839;Train/tea_AA_05_6_ud211.conllu;LRE portaali loomine koosneb 4 iteratsioonist :;0;3;LRE;bound;portaali loomine koosneb 4 iteratsioonist :;100.0;100.0;100.0;no;('LRE', 0, 2, 'koosneb', 4);LRE;koosneb
74137;Train/tea_eesti_arst_2004_osa_4_ud211.conllu;Kolmes Euroopa riigis ( Rootsi , Island , Belgia ) korraldatud noorte täiskasvanute unehäirete uuring näitas , et sama metoodika rakendamisel ei ole unehäirete varieeruvus erinevates piirkondades kuigi oluline ( 3 ) .;172;195;erinevates piirkondades;bound;Kolmes Euroopa riigis ( Rootsi , Island , Belgia ) korraldatud noorte täiskasvanute unehäirete uuring näitas , et sama metoodika rakendamisel ei ole unehäirete varieeruvus kuigi oluline ( 3 ) .;96.8;100.0;96.8;no;('piirkondades', 26, 25, 'näitas', 16);piirkondades;näitas
72833;Train/aja_ml200247_osa_1_ud211.conllu;President Arnold Rüütli Suurbritannia töövisiidi tipphetkedeks said loeng tudengitele Oxfordis ja kohtumine Walesi printsiga Londonis;125;133;Londonis;bound;President Arnold Rüütli Suurbritannia töövisiidi tipphetkedeks said loeng tudengitele Oxfordis ja kohtumine Walesi printsiga ;92.9;92.9;100.0;no;('Londonis', 14, 12, 'said', 7);Londonis;said
72690;Train/aja_ee199920_osa_2_ud211.conllu;Mina ei tea , kas teedesse tekitavad pikivagusid naastrehvid või kümnete tonnide jagu ülekaalulised metsa- ja naftakoormad .;65;80;kümnete tonnide;bound;Mina ei tea , kas teedesse tekitavad pikivagusid naastrehvid või jagu ülekaalulised metsa- ja naftakoormad .;87.5;87.5;93.8;no;('kümnete', 10, 12, 'tekitavad', 7);kümnete;tekitavad
74046;Dev/tea_eesti_arst_2004_osa_1_ud211.conllu;Kirjanduses on andmeid , et selliste perede esinemissagedus kõikide lastetute perede seas on väga harv , olles ainult 0,18 % ( 5 ) .;28;43;selliste perede;bound;Kirjanduses on andmeid , et esinemissagedus kõikide lastetute perede seas on väga harv , olles ainult 0,18 % ( 5 ) .;;;;no;('selliste', 5, 7, 'on', 2);selliste;on
72556;Train/tea_eesti_arst_2004_osa_2_ud211.conllu;AL-ladestuste immunohistokeemiline värving saadaolevate monoklonaalsete antikehadega võib tihti osutuda negatiivseks tänu AL heterogeensele päritolule , kuid AA- ja ATTR-amüloidi immunohistokeemiline kõrvalejätmine muudab hingamiselundite amüloidoosi korral AL-tüübi väga tõenäoliseks ( 5 ) .;0;13;AL-ladestuste;bound;immunohistokeemiline värving saadaolevate monoklonaalsete antikehadega võib tihti osutuda negatiivseks tänu AL heterogeensele päritolule , kuid AA- ja ATTR-amüloidi immunohistokeemiline kõrvalejätmine muudab hingamiselundite amüloidoosi korral AL-tüübi väga tõenäoliseks ( 5 ) .;100.0;100.0;100.0;no;('AL-ladestuste', 0, 3, 'osutuda', 9);AL-ladestuste;osutuda
73086;Train/tea_toohoive.conllu;Mitmed autorid on analüüsinud Eesti tööturul toimunud arenguid ja toonud välja ka erinevusi 90ndate alguse ja lõpu vahel Eesti tööturul , mis on seotud nii majanduskeskkonna arengu kui ka tööturu institutsionaalse korralduse arenguga ( Eamets jt. 2000 , Täht ja Unt , 2001 , Kazjulja , 20021 , Helemäe , 2002 , Täht , 2002 , Eamets , 2001 , Rõõm , 2002 , Paas et al , 2003 jt ) .;373;375;jt;bound;Mitmed autorid on analüüsinud Eesti tööturul toimunud arenguid ja toonud välja ka erinevusi 90ndate alguse ja lõpu vahel Eesti tööturul , mis on seotud nii majanduskeskkonna arengu kui ka tööturu institutsionaalse korralduse arenguga ( Eamets jt. 2000 , Täht ja Unt , 2001 , Kazjulja , 20021 , Helemäe , 2002 , Täht , 2002 , Eamets , 2001 , Rõõm , 2002 , Paas et al , 2003 ) .;40.8;42.3;88.7;no;('jt', 69, 65, 'analüüsinud', 4);jt;analüüsinud
74026;Train/tea_eesti_arst_2004_osa_3_ud211.conllu;Preparaadi lahjendamine või samas süstlas koos teiste ravimitega võib muuta LANTUS'e aegtoime kõverat või põhjustada sademe teket .;42;64;koos teiste ravimitega;bound;Preparaadi lahjendamine või samas süstlas võib muuta LANTUS'e aegtoime kõverat või põhjustada sademe teket .;100.0;100.0;100.0;no;('ravimitega', 7, 5, 'muuta', 10);ravimitega;muuta
73832;Train/tea_eesti_arst_2004_osa_2_ud211.conllu;Võimalikud komplikatsioonid sel puhul on uriinileke kateetri kõrvalt , põiekivide teke , uroinfektsioon , kateetri obstruktsioon ja naha infektsioon .;106;114;kateetri;bound;Võimalikud komplikatsioonid sel puhul on uriinileke kateetri kõrvalt , põiekivide teke , uroinfektsioon , obstruktsioon ja naha infektsioon .;94.7;100.0;94.7;no;('kateetri', 14, 16, 'on', 5);kateetri;on
73600;Train/tea_dr8047.conllu;Nendest tuntuim sinapiin , mis võib põhjustada pruune mune munevate kanatõugude munades kalamaitset ( sinapiinist moodustub trimetüülamiin , mis siirdub munadesse valgu moodustumise protsessis ) .;163;168;valgu;bound;Nendest tuntuim sinapiin , mis võib põhjustada pruune mune munevate kanatõugude munades kalamaitset ( sinapiinist moodustub trimetüülamiin , mis siirdub munadesse moodustumise protsessis ) .;100.0;100.0;100.0;no;('valgu', 21, 23, 'siirdub', 20);valgu;siirdub
73985;Train/aja_ee199920_osa_1_ud211.conllu;1998. aasta lõpus müüs Feer oma osa Väike-Munamäe Arendusest firmale Panthera Unica , praeguse nimega OÜ Baltic International Services , jäädes ise võlausaldaja rolli .;36;60;Väike-Munamäe Arendusest;bound;1998. aasta lõpus müüs Feer oma osa firmale Panthera Unica , praeguse nimega OÜ Baltic International Services , jäädes ise võlausaldaja rolli .;82.6;100.0;82.6;no;('Arendusest', 8, 7, 'müüs', 4);Arendusest;müüs
72886;Train/aja_epl20061216_ud211.conllu;Tartu Pere Leib kaotas eurosarja alagrupiturniiri avamängus Ukraina Mariupoli Azovstalile 1 : 3 .;0;5;Tartu;bound;Pere Leib kaotas eurosarja alagrupiturniiri avamängus Ukraina Mariupoli Azovstalile 1 : 3 .;;;;no;('Tartu', 0, 3, 'kaotas', 4);Tartu;kaotas
72747;Train/aja_horisont2000_osa_1_ud211.conllu;Mustade aukude tants;0;14;Mustade aukude;bound;tants;100.0;100.0;100.0;no;('Mustade', 0, 2, None, None);Mustade;
74432;Train/tea_toohoive.conllu;Seejärel teostati Glejseri testide abil heteroskedatiivsuse analüüs ning kaalutud vähimruutude meetodi abil heteroskedatiivsuse elimineerimine .;73;94;kaalutud vähimruutude;bound;Seejärel teostati Glejseri testide abil heteroskedatiivsuse analüüs ning meetodi abil heteroskedatiivsuse elimineerimine .;84.6;92.3;92.3;no;('kaalutud', 8, 10, 'teostati', 2);kaalutud;teostati
74107;Train/aja_ee200110_osa_5_ud211.conllu;"Nukufilmi eeskujuks on 1963 valminud "" Suur põgenemine "" ameerika sõjavangide elust Saksa vangilaagris .";0;9;Nukufilmi;bound;"eeskujuks on 1963 valminud "" Suur põgenemine "" ameerika sõjavangide elust Saksa vangilaagris .";57.1;57.1;64.3;no;('Nukufilmi', 0, 2, 'on', 3);Nukufilmi;on
74798;Train/aja_luup200202_osa_1_ud211.conllu;Nii jõudis 1954. aastal Tartu Ülikooli lõpetanud tohter karjääriredelil liikudes läbi provintsihaigla jaoskonnaarsti , siseosakonna juhataja ja peaarsti viimaks pealinna .;119;131;siseosakonna;bound;Nii jõudis 1954. aastal Tartu Ülikooli lõpetanud tohter karjääriredelil liikudes läbi provintsihaigla jaoskonnaarsti , juhataja ja peaarsti viimaks pealinna .;95.0;100.0;95.0;no;('siseosakonna', 14, 16, 'jõudis', 2);siseosakonna;jõudis
74683;Train/tea_toohoive.conllu;Töö esimeses osas esitame uuringu kontseptsiooni koos teoreetiliste ja metodoloogiliste lähenemiste ülevaatega .;26;33;uuringu;bound;Töö esimeses osas esitame kontseptsiooni koos teoreetiliste ja metodoloogiliste lähenemiste ülevaatega .;100.0;100.0;100.0;no;('uuringu', 4, 6, 'esitame', 4);uuringu;esitame
73960;Train/ilu_valton_ud211.conllu;Eks nood ju armastanud teda ning said selmoel oma isanda õnnest osa .;46;56;oma isanda;bound;Eks nood ju armastanud teda ning said selmoel õnnest osa .;100.0;100.0;100.0;no;('oma', 8, 10, 'said', 7);oma;said
72076;Train/tea_eesti_arst_2004_osa_2_ud211.conllu;Sõlmelised vormid kujutavad endast tüüpiliselt paikset AL-amüloidoosi , difuusne alveoseptaalne vorm on difuusse amüloidoosi väljenduseks .;104;124;difuusse amüloidoosi;bound;Sõlmelised vormid kujutavad endast tüüpiliselt paikset AL-amüloidoosi , difuusne alveoseptaalne vorm on väljenduseks .;78.6;92.9;85.7;no;('difuusse', 12, 14, 'kujutavad', 3);difuusse;kujutavad
74047;Dev/tea_eesti_arst_2004_osa_1_ud211.conllu;Kirjanduses on andmeid , et selliste perede esinemissagedus kõikide lastetute perede seas on väga harv , olles ainult 0,18 % ( 5 ) .;60;89;kõikide lastetute perede seas;bound;Kirjanduses on andmeid , et selliste perede esinemissagedus on väga harv , olles ainult 0,18 % ( 5 ) .;;;;no;('perede', 10, 8, 'on', 2);perede;on
72797;Train/tea_dr8047.conllu;Kalaõli söötmise mõju munarebu ω-3-rasvhapete sisaldusele , % üldlipiididest ( Leeson , 1999 );31;45;ω-3-rasvhapete;bound;Kalaõli söötmise mõju munarebu sisaldusele , % üldlipiididest ( Leeson , 1999 );100.0;100.0;100.0;no;('ω-3-rasvhapete', 4, 6, None, None);ω-3-rasvhapete;
72811;Train/tea_geofyysika.conllu;Kaasajal mõeldakse vaatluse all enamasti füüsikalist mõõtmist , kuid näiteks pilvede tüübi ja pilvisuse palli määramised on siiani klassikalised vaatlused .;77;84;pilvede;bound;Kaasajal mõeldakse vaatluse all enamasti füüsikalist mõõtmist , kuid näiteks tüübi ja pilvisuse palli määramised on siiani klassikalised vaatlused .;85.0;85.0;90.0;no;('pilvede', 10, 12, 'mõeldakse', 2);pilvede;mõeldakse
73102;Train/ilu_maailm_ud211.conllu;Minu nähes ei teinud ta midagi muud peale õppimise .;36;50;peale õppimise;bound;Minu nähes ei teinud ta midagi muud .;87.5;87.5;87.5;no;('õppimise', 8, 7, 'teinud', 4);õppimise;teinud
72486;Train/aja_pm20001004_osa_1_ud211.conllu;""" Mulle jäänud mulje järgi kalduvad komisjoni liikmed selgelt toetama põllumajandusülikooli poolitamist , "" tõdes Tartu Postimehele Eesti Üliõpilaskondade Liidu juhatuse esimees Leif Kalev , kes kuulub ka ise haridusministrit nõustavasse komisjoni .";36;45;komisjoni;bound;""" Mulle jäänud mulje järgi kalduvad liikmed selgelt toetama põllumajandusülikooli poolitamist , "" tõdes Tartu Postimehele Eesti Üliõpilaskondade Liidu juhatuse esimees Leif Kalev , kes kuulub ka ise haridusministrit nõustavasse komisjoni .";93.8;93.8;100.0;no;('komisjoni', 31, 27, 'kuulub', 27);komisjoni;kuulub
72738;Train/tea_geofyysika.conllu;Maa pöörlemiskiiruse muutumisel on rohkem põhjusi kui neid tavapäraselt välja on toodud .;0;20;Maa pöörlemiskiiruse;bound;muutumisel on rohkem põhjusi kui neid tavapäraselt välja on toodud .;100.0;100.0;100.0;no;('Maa', 0, 2, 'on', 4);Maa;on
72612;Train/tea_eesti_arst_2004_osa_2_ud211.conllu;Seljaaju suprasakraalse kahjustuse korral võib detrusor'i hüper-refleksiale lisanduda ka põie tühjendajalihase ning ureetra sfinkteri töö koordineerimatus : detrusor ja ureetra sfinkter kontraheeruvad ühel ajal - detrusor'i-sfinkteri düssünergia .;89;133;põie tühjendajalihase ning ureetra sfinkteri;bound;Seljaaju suprasakraalse kahjustuse korral võib detrusor'i hüper-refleksiale lisanduda ka töö koordineerimatus : detrusor ja ureetra sfinkter kontraheeruvad ühel ajal - detrusor'i-sfinkteri düssünergia .;82.6;82.6;91.3;no;('põie', 9, 11, 'lisanduda', 8);põie;lisanduda
73799;Train/aja_luup200106_osa_2_ud211.conllu;IR : Kõik taotlevad kapitali vabal liikumisel erandeid maa müügiks , meie lubame maad osta mitte ainult ELi , vaid ka kolmandate riikide kodanikel .;20;28;kapitali;bound;IR : Kõik taotlevad vabal liikumisel erandeid maa müügiks , meie lubame maad osta mitte ainult ELi , vaid ka kolmandate riikide kodanikel .;83.3;91.7;91.7;no;('kapitali', 4, 7, 'taotlevad', 4);kapitali;taotlevad
74397;Train/tea_eesti_arst_2004_osa_2_ud211.conllu;Serooskesta haaratusega haigust esineb umbes 10 %-l juhtudest ning selle korral on kirjeldatud eosinofiilset astsiiti ja pleura efusiooni ( 1 , 4 , 10 , 16 ) .;0;11;Serooskesta;bound;haaratusega haigust esineb umbes 10 %-l juhtudest ning selle korral on kirjeldatud eosinofiilset astsiiti ja pleura efusiooni ( 1 , 4 , 10 , 16 ) .;;;;no;('Serooskesta', 0, 2, 'esineb', 4);Serooskesta;esineb
72887;Train/aja_epl20061216_ud211.conllu;Tartu Pere Leib kaotas eurosarja alagrupiturniiri avamängus Ukraina Mariupoli Azovstalile 1 : 3 .;6;10;Pere;bound;Tartu Leib kaotas eurosarja alagrupiturniiri avamängus Ukraina Mariupoli Azovstalile 1 : 3 .;;;;no;('Pere', 1, 3, 'kaotas', 4);Pere;kaotas
73874;Train/tea_toohoive.conllu;( Iiri näite puhul õnnestusid need eesmärgid saavutada küllalt lühikese aja jooksul ja seejärel hakkas palk koos tootluse tõusu ja majanduskasvuga uuesti tõusma . );113;121;tootluse;bound;( Iiri näite puhul õnnestusid need eesmärgid saavutada küllalt lühikese aja jooksul ja seejärel hakkas palk koos tõusu ja majanduskasvuga uuesti tõusma . );91.7;91.7;95.8;no;('tootluse', 17, 19, 'hakkas', 15);tootluse;hakkas
72804;Train/tea_eesti_arst_2004_osa_4_ud211.conllu;Eriti suur on Tähti Saare panus kardioanesteesia ja kardiointensiivravi , samuti pulmonoloogilise intensiivravi ja lasteanesteesia arengusse Eestis .;32;130;kardioanesteesia ja kardiointensiivravi , samuti pulmonoloogilise intensiivravi ja lasteanesteesia;bound;Eriti suur on Tähti Saare panus arengusse Eestis .;100.0;100.0;100.0;no;('kardiointensiivravi', 8, 7, 'on', 3);kardiointensiivravi;on
72982;Train/tea_AA_05_6_ud211.conllu;See soodustab ka IKT alal aeglasemalt edenenud organisatsioonide liitumist ja kiirendab nende arengut .;14;64;ka IKT alal aeglasemalt edenenud organisatsioonide;bound;See soodustab liitumist ja kiirendab nende arengut .;100.0;100.0;100.0;no;('IKT', 3, 5, 'soodustab', 2);IKT;soodustab
73990;Train/aja_pm19980926e_ud211.conllu;Nii nagu Ebro kallastel on ka Duero veinimeistritel jätkunud rahakaid kliente .;9;13;Ebro;bound;Nii nagu kallastel on ka Duero veinimeistritel jätkunud rahakaid kliente .;81.8;90.9;90.9;no;('Ebro', 2, 4, 'jätkunud', 9);Ebro;jätkunud
72991;Train/aja_luup200106_osa_5_ud211.conllu;Kuni Vene-Liivi sõja puhkemiseni puudus kuninga plaanidel ometi reaalne kate .;40;47;kuninga;bound;Kuni Vene-Liivi sõja puhkemiseni puudus plaanidel ometi reaalne kate .;100.0;100.0;100.0;no;('kuninga', 5, 7, 'puudus', 5);kuninga;puudus
72526;Train/tea_AA_05_6_ud211.conllu;Kõrge jõudluse saavutamiseks on vajalik , et programmi töötlus toimuks CFGs võimalikult rööpsena ( liigutakse rööpselt piki graafi paralleelseid teid ) .;0;14;Kõrge jõudluse;bound;saavutamiseks on vajalik , et programmi töötlus toimuks CFGs võimalikult rööpsena ( liigutakse rööpselt piki graafi paralleelseid teid ) .;95.0;100.0;95.0;no;('Kõrge', 0, 2, 'on', 4);Kõrge;on
73228;Train/tea_toohoive.conllu;Masinad võivad tööjõu tarvidust vähendada eelkõige olukorras , kus kogutootlikkuse paranemisest tulenevat toodangu mahtu ei saa mingitel põhjustel ( näiteks turgude kokkutõmbumine ) tugevasti suurendada , muidu suureneks tehnoloogia hooldajate arv sama palju või rohkemgi kui väheneb tehnoloogiaga asendatud töökohtade arv .;157;164;turgude;bound;Masinad võivad tööjõu tarvidust vähendada eelkõige olukorras , kus kogutootlikkuse paranemisest tulenevat toodangu mahtu ei saa mingitel põhjustel ( näiteks kokkutõmbumine ) tugevasti suurendada , muidu suureneks tehnoloogia hooldajate arv sama palju või rohkemgi kui väheneb tehnoloogiaga asendatud töökohtade arv .;97.6;100.0;97.6;no;('turgude', 20, 22, 'suurendada', 25);turgude;suurendada
72163;Train/tea_geofyysika.conllu;Need ebasünkroonsused tekitavad ebakõla sisetuuma ja vahevöö gravitatsioonilises tasakaalus ning nurkmomendi ümberjagunemise tasakaalustumise käigus .;97;124;nurkmomendi ümberjagunemise;bound;Need ebasünkroonsused tekitavad ebakõla sisetuuma ja vahevöö gravitatsioonilises tasakaalus ning tasakaalustumise käigus .;69.2;69.2;76.9;no;('nurkmomendi', 10, 12, 'tekitavad', 3);nurkmomendi;tekitavad
72591;Train/aja_luup200106_osa_4_ud211.conllu;Partia ehk tänapäeva Iraani kuningas saatis Sureni isa kohe pärast poja sündi Armeenia kuningat Khosrovi tapma .;11;20;tänapäeva;bound;Partia ehk Iraani kuningas saatis Sureni isa kohe pärast poja sündi Armeenia kuningat Khosrovi tapma .;93.8;93.8;93.8;no;('tänapäeva', 2, 4, 'saatis', 6);tänapäeva;saatis
72845;Train/aja_ee199920_osa_2_ud211.conllu;Üks neist institutsioonidest , kes on oma usaldusväärsust tõestanud , tuleks panna Hüvitusfondi järelevalvajaks .;83;95;Hüvitusfondi;bound;Üks neist institutsioonidest , kes on oma usaldusväärsust tõestanud , tuleks panna järelevalvajaks .;92.9;92.9;92.9;no;('Hüvitusfondi', 12, 14, 'panna', 12);Hüvitusfondi;panna
74055;Dev/aja_luup200009_ud211.conllu;“ Ühel kaptenite kursusel kasutati seda intsidenti kui näidet sellest , kuidas ei tohi teha , ” ütles mereväe suhtekorraldusülem .;62;91;sellest , kuidas ei tohi teha;bound;“ Ühel kaptenite kursusel kasutati seda intsidenti kui näidet , ” ütles mereväe suhtekorraldusülem .;73.3;73.3;86.7;no;(',', 15, 5, 'kasutati', 5);,;kasutati
73820;Train/tea_toohoive.conllu;Väliskapitali ( Iirimaa puhul kallima , Tšehhi näite puhul odavama allhanke tootmisesse investeeritud kapital ) otsest tööhõivet loova võime suhtes kutsuvad nii Iirimaa näide ( mõlemad ajaperioodid ) kui Tšehhi näide ( 1990. aastate teine pool ) üles ettevaatusele .;0;111;Väliskapitali ( Iirimaa puhul kallima , Tšehhi näite puhul odavama allhanke tootmisesse investeeritud kapital );bound;otsest tööhõivet loova võime suhtes kutsuvad nii Iirimaa näide ( mõlemad ajaperioodid ) kui Tšehhi näide ( 1990. aastate teine pool ) üles ettevaatusele .;88.0;100.0;88.0;no;('kapital', 13, 1, 'kutsuvad', 21);kapital;kutsuvad
73565;Train/aja_luup200202_osa_3_ud211.conllu;Põhjamaade mudel käsitleb terviseseisundit kajastavate isikuandmetega registrite rajamist ühiskonna huvina ning andmete saatmine registrisse ei eelda isiku nõusolekut .;26;80;terviseseisundit kajastavate isikuandmetega registrite;bound;Põhjamaade mudel käsitleb rajamist ühiskonna huvina ning andmete saatmine registrisse ei eelda isiku nõusolekut .;93.3;93.3;93.3;no;('terviseseisundit', 3, 5, 'käsitleb', 3);terviseseisundit;käsitleb
74306;Train/tea_AA_05_6_ud211.conllu;Kelmuste avastamine ( fraud detection ) on seni olnud kaevandamise praktilise rakendamise lipulaev , sest kurjategijad proovivadki ekspluateerida inimeste võimetust suurte hulkade puhul avastada seda , et mängitakse väikestele kõrvalekalletele .;54;89;kaevandamise praktilise rakendamise;bound;Kelmuste avastamine ( fraud detection ) on seni olnud lipulaev , sest kurjategijad proovivadki ekspluateerida inimeste võimetust suurte hulkade puhul avastada seda , et mängitakse väikestele kõrvalekalletele .;100.0;100.0;100.0;no;('kaevandamise', 9, 12, 'on', 7);kaevandamise;on
