id;fpath;sentence;remove_start;remove_end;removed;type;short_sent;cons_score;ual;la;removetype;sentence_analysis_data;peasona;verb
72497;Train/aja_pm20001004_osa_2_ud211.conllu;Kunagise turbaimpeeriumi pealinn Tootsi on üks paljudest viletsasse seisu sattunud omavalitsustest , kes nüüd näevad valitsuse reservfondis , regionaalarengu sihtasutuses või eelarvevälises omandireformi fondis viimast õlekõrt , mis nad võlgade keerisest kindlale pinnale välja tõmbaks .;0;24;Kunagise turbaimpeeriumi;bound;pealinn Tootsi on üks paljudest viletsasse seisu sattunud omavalitsustest , kes nüüd näevad valitsuse reservfondis , regionaalarengu sihtasutuses või eelarvevälises omandireformi fondis viimast õlekõrt , mis nad võlgade keerisest kindlale pinnale välja tõmbaks .;100.0;100.0;100.0;no;('Kunagise', 0, 2, 'on', 5);Kunagise;on
74365;Train/aja_ee199920_osa_2_ud211.conllu;"Tahaks loota , et meil pole lamellrehvide tootjatel valitsuses "" oma meest Havannas "" , kes suurfirma tulu nimel läbi suruks kümneid elusid päästva turvameetme tühistamise .";28;41;lamellrehvide;bound;"Tahaks loota , et meil pole tootjatel valitsuses "" oma meest Havannas "" , kes suurfirma tulu nimel läbi suruks kümneid elusid päästva turvameetme tühistamise .";92.3;96.2;92.3;no;('lamellrehvide', 6, 8, 'loota', 2);lamellrehvide;loota
74924;Dev/aja_luup200009_ud211.conllu;Tegelikult läks lõunast õhtul kella poole üheksani .;24;29;õhtul;bound;Tegelikult läks lõunast kella poole üheksani .;71.4;71.4;71.4;no;('õhtul', 3, 5, 'läks', 2);õhtul;läks
74044;Train/tea_toohoive.conllu;See efekt ei ole siiski nii oluline kaua turul püsinud ( ja keskmisest suuremate ) ettevõtete puhul , kus väliskapitali ja ekspordi ( viitajaga 1 aasta ) tööhõivet suurendav mõju on täheldatav vaid aastatel 1998-1999 .;144;151;1 aasta;bound;See efekt ei ole siiski nii oluline kaua turul püsinud ( ja keskmisest suuremate ) ettevõtete puhul , kus väliskapitali ja ekspordi ( viitajaga ) tööhõivet suurendav mõju on täheldatav vaid aastatel 1998-1999 .;79.4;79.4;91.2;no;('aasta', 25, 24, 'ei', 3);aasta;ei
72827;Train/aja_ml200247_osa_1_ud211.conllu;President Arnold Rüütli Suurbritannia töövisiidi tipphetkedeks said loeng tudengitele Oxfordis ja kohtumine Walesi printsiga Londonis;0;48;President Arnold Rüütli Suurbritannia töövisiidi;bound;tipphetkedeks said loeng tudengitele Oxfordis ja kohtumine Walesi printsiga Londonis;90.0;90.0;100.0;no;('Arnold', 1, 1, 'said', 7);Arnold;said
74260;Train/tea_eesti_arst_2004_osa_2_ud211.conllu;Sageli võivad invasiiv-diagnostilisel eesmärgil teostatava sõlmede eemaldamise järel amüloidoosikolded taastekkida , seejuures on teadmata , kas põhjuseks on ebatäielik resektsioon või areneb haigus ise edasi uute sõlmede moodustumisega .;199;202;ise;bound;Sageli võivad invasiiv-diagnostilisel eesmärgil teostatava sõlmede eemaldamise järel amüloidoosikolded taastekkida , seejuures on teadmata , kas põhjuseks on ebatäielik resektsioon või areneb haigus edasi uute sõlmede moodustumisega .;96.4;96.4;100.0;no;('ise', 23, 23, 'areneb', 22);ise;areneb
72175;Dev/aja_ml200247_osa6_ud211.conllu;Eessõnas teatab autor Berta Björklund , et laotab lugeja ette ühe väikese osa oma elust , mis oli täis rõõmutuid päevi , ja soovib , et inimeste suhtumine üksteisesse oleks inimväärne .;78;87;oma elust;bound;Eessõnas teatab autor Berta Björklund , et laotab lugeja ette ühe väikese osa , mis oli täis rõõmutuid päevi , ja soovib , et inimeste suhtumine üksteisesse oleks inimväärne .;73.3;80.0;83.3;no;('elust', 14, 13, 'laotab', 8);elust;laotab
72671;Train/aja_ee199920_osa_1_ud211.conllu;See on Šveitsi suurima panga UBSi haru , mis on tuntud numbrikontode poolest .;7;14;Šveitsi;bound;See on suurima panga UBSi haru , mis on tuntud numbrikontode poolest .;100.0;100.0;100.0;no;('Šveitsi', 2, 5, 'on', 2);Šveitsi;on
72219;Dev/aja_ee199920_osa4_ud211.conllu;"KAIDO KAMA -- teened VKKF-i loomisel ja edu Võru Instituudi juhtimisel ;";44;70;Võru Instituudi juhtimisel;bound;"KAIDO KAMA -- teened VKKF-i loomisel ja edu ;";77.8;88.9;88.9;no;('juhtimisel', 10, 8, None, None);juhtimisel;
74094;Train/aja_ee200110_osa_3_ud211.conllu;Mõlema dokumendi koopia on olemas ka Eesti Ekspressil .;37;42;Eesti;bound;Mõlema dokumendi koopia on olemas ka Ekspressil .;100.0;100.0;100.0;no;('Eesti', 6, 8, 'on', 4);Eesti;on
74257;Train/aja_ee199920_osa_3_ud211.conllu;Laste ostuvõime kasvab pidevalt;0;5;Laste;bound;ostuvõime kasvab pidevalt;100.0;100.0;100.0;no;('Laste', 0, 2, 'kasvab', 3);Laste;kasvab
73797;Train/tea_toohoive.conllu;3 ) ekspordi maht sektorites , milles meil on suhteline eelis;4;12;ekspordi;bound;3 ) maht sektorites , milles meil on suhteline eelis;100.0;100.0;100.0;no;('ekspordi', 2, 4, 'on', 9);ekspordi;on
73744;Train/aja_horisont2000_osa_2_ud211.conllu;Sikhismi kui suhteliselt noore religiooni algus on dateeritav Guru Nanaki ( 1469-1539 ) tegevusega .;62;87;Guru Nanaki ( 1469-1539 );bound;Sikhismi kui suhteliselt noore religiooni algus on dateeritav tegevusega .;90.0;90.0;100.0;no;('Nanaki', 9, 9, 'on', 7);Nanaki;on
72152;Train/aja_horisont2000_osa_2_ud211.conllu;Nad on teatud mõttes nagu vahelüliks teaduse ja biotehnoloogiatööstuse vahel .;37;76;teaduse ja biotehnoloogiatööstuse vahel;bound;Nad on teatud mõttes nagu vahelüliks .;100.0;100.0;100.0;no;('teaduse', 6, 6, 'on', 2);teaduse;on
73334;Train/aja_ml200247_osa_2_ud211.conllu;Tallinna Sadam ehitab Saaremaa süvasadama Küdema lahe läänerannikule endisesse Tamme sadamakohta Mustjala valda .;79;84;Tamme;bound;Tallinna Sadam ehitab Saaremaa süvasadama Küdema lahe läänerannikule endisesse sadamakohta Mustjala valda .;100.0;100.0;100.0;no;('Tamme', 9, 11, 'ehitab', 3);Tamme;ehitab
72487;Train/aja_pm20001004_osa_1_ud211.conllu;""" Mulle jäänud mulje järgi kalduvad komisjoni liikmed selgelt toetama põllumajandusülikooli poolitamist , "" tõdes Tartu Postimehele Eesti Üliõpilaskondade Liidu juhatuse esimees Leif Kalev , kes kuulub ka ise haridusministrit nõustavasse komisjoni .";70;91;põllumajandusülikooli;bound;""" Mulle jäänud mulje järgi kalduvad komisjoni liikmed selgelt toetama poolitamist , "" tõdes Tartu Postimehele Eesti Üliõpilaskondade Liidu juhatuse esimees Leif Kalev , kes kuulub ka ise haridusministrit nõustavasse komisjoni .";93.8;93.8;100.0;no;('põllumajandusülikooli', 10, 12, 'toetama', 10);põllumajandusülikooli;toetama
72447;Train/aja_luup200106_osa_2_ud211.conllu;Just seal kuulsin ma Jugoslaavia juhtiva kommunisti Milovan Djilase raamatust “ Uus klass .;21;32;Jugoslaavia;bound;Just seal kuulsin ma juhtiva kommunisti Milovan Djilase raamatust “ Uus klass .;100.0;100.0;100.0;no;('Jugoslaavia', 4, 7, 'kuulsin', 3);Jugoslaavia;kuulsin
74710;Train/tea_eesti_arst_2004_osa_2_ud211.conllu;· Amüloidi eellasproteiinide stabiliseerimiseks;2;28;Amüloidi eellasproteiinide;bound;· stabiliseerimiseks;100.0;100.0;100.0;no;('eellasproteiinide', 2, 2, None, None);eellasproteiinide;
72488;Train/aja_pm20001004_osa_1_ud211.conllu;""" Mulle jäänud mulje järgi kalduvad komisjoni liikmed selgelt toetama põllumajandusülikooli poolitamist , "" tõdes Tartu Postimehele Eesti Üliõpilaskondade Liidu juhatuse esimees Leif Kalev , kes kuulub ka ise haridusministrit nõustavasse komisjoni .";114;119;Tartu;bound;""" Mulle jäänud mulje järgi kalduvad komisjoni liikmed selgelt toetama põllumajandusülikooli poolitamist , "" tõdes Postimehele Eesti Üliõpilaskondade Liidu juhatuse esimees Leif Kalev , kes kuulub ka ise haridusministrit nõustavasse komisjoni .";93.8;93.8;100.0;no;('Tartu', 15, 17, 'tõdes', 15);Tartu;tõdes
73978;Train/aja_luup200106_osa_4_ud211.conllu;Eriti nüüd , kui Erki Noole , Jaan Kirsipuu , Kaia Kanepi ja teiste eeskujud poistel-tüdrukutel silme ees .;77;95;poistel-tüdrukutel;bound;Eriti nüüd , kui Erki Noole , Jaan Kirsipuu , Kaia Kanepi ja teiste eeskujud silme ees .;100.0;100.0;100.0;no;('poistel-tüdrukutel', 15, 15, None, None);poistel-tüdrukutel;
72379;Train/tea_dr8047.conllu;Nende katsetes uuriti võrdlevalt kala- ja linaõli söötmise mõju broileriliha rasvhapete sisaldusele .;33;58;kala- ja linaõli söötmise;bound;Nende katsetes uuriti võrdlevalt mõju broileriliha rasvhapete sisaldusele .;88.9;88.9;100.0;no;('linaõli', 6, 5, 'uuriti', 3);linaõli;uuriti
74326;Dev/aja_epl20070812_ud211.conllu;""" Tehnika on mulle huvitav sellepärast , et kui foto jäädvustab hetke , siis assamblaaž jäädvustab esemeid ja materiaalseid vorme ja nende järeletegemine teisel ajal on võimatu .";133;138;nende;bound;""" Tehnika on mulle huvitav sellepärast , et kui foto jäädvustab hetke , siis assamblaaž jäädvustab esemeid ja materiaalseid vorme ja järeletegemine teisel ajal on võimatu .";74.1;81.5;81.5;no;('nende', 21, 23, 'jäädvustab', 16);nende;jäädvustab
73560;Train/aja_pm19980926e_ud211.conllu;Hooaja algusest saadik ei ole muud kui üksindus ja lõputu ootamine .;0;6;Hooaja;bound;algusest saadik ei ole muud kui üksindus ja lõputu ootamine .;100.0;100.0;100.0;no;('Hooaja', 0, 2, 'ei', 4);Hooaja;ei
73466;Train/tea_AA_05_6_ud211.conllu;ärilise poole mõistmine - esimene etapp keskendub projekti ärilistele eesmärkidele ja nõuetele , püüab formuleerida selle teadmise andmekaevanduse probleemipüstitusena ning pakkuda välja esialgse plaani eesmärkide täitmiseks;0;13;ärilise poole;bound;mõistmine - esimene etapp keskendub projekti ärilistele eesmärkidele ja nõuetele , püüab formuleerida selle teadmise andmekaevanduse probleemipüstitusena ning pakkuda välja esialgse plaani eesmärkide täitmiseks;87.5;91.7;91.7;no;('ärilise', 0, 2, 'keskendub', 7);ärilise;keskendub
73465;Train/arborest_ud211.conllu;Ta silmad ekslesid toas mööda seinu maalilt maalile .;36;43;maalilt;bound;Ta silmad ekslesid toas mööda seinu maalile .;100.0;100.0;100.0;no;('maalilt', 6, 8, 'ekslesid', 3);maalilt;ekslesid
73327;Train/aja_luup200106_osa_5_ud211.conllu;Ometi saabus lahendus alles poolteist sajandit hiljem suurriikluse hääbumisel Põhjasõja alguses .;54;66;suurriikluse;bound;Ometi saabus lahendus alles poolteist sajandit hiljem hääbumisel Põhjasõja alguses .;90.9;90.9;100.0;no;('suurriikluse', 7, 9, 'saabus', 2);suurriikluse;saabus
72215;Dev/aja_ee199920_osa4_ud211.conllu;"KAIDO KAMA -- teened VKKF-i loomisel ja edu Võru Instituudi juhtimisel ;";21;27;VKKF-i;bound;"KAIDO KAMA -- teened loomisel ja edu Võru Instituudi juhtimisel ;";81.8;90.9;90.9;no;('VKKF-i', 4, 6, None, None);VKKF-i;
73212;Train/aja_ee200110_osa_3_ud211.conllu;Vene Draamateatri keldris , endistes restoran Astoria ruumides on ennast sisse seadnud Monte-Carlo kasiino .;0;4;Vene;bound;Draamateatri keldris , endistes restoran Astoria ruumides on ennast sisse seadnud Monte-Carlo kasiino .;85.7;85.7;100.0;no;('Vene', 0, 2, 'seadnud', 12);Vene;seadnud
72278;Train/aja_luup200106_osa_3_ud211.conllu;Ka seda , et perestroika sai alguse reformimeelsete kommunistide initsiatiivist .;36;64;reformimeelsete kommunistide;bound;Ka seda , et perestroika sai alguse initsiatiivist .;100.0;100.0;100.0;no;('reformimeelsete', 7, 9, 'sai', 6);reformimeelsete;sai
74694;Train/aja_pm19980926e_ud211.conllu;Iseäranis raske on mantliga söömisel .;19;27;mantliga;bound;Iseäranis raske on söömisel .;100.0;100.0;100.0;no;('mantliga', 3, 5, 'on', 3);mantliga;on
73540;Train/aja_luup200106_osa_2_ud211.conllu;Tartus , 4. novembril 1956. aastal , Ungari ülestõusu toetuseks levitatud lendlehed viisid meid , põrandaaluse organisatsiooni Eesti Noorte Malev liikmeid , Mordva poliitvangide koonduslaagrisse .;37;43;Ungari;bound;Tartus , 4. novembril 1956. aastal , ülestõusu toetuseks levitatud lendlehed viisid meid , põrandaaluse organisatsiooni Eesti Noorte Malev liikmeid , Mordva poliitvangide koonduslaagrisse .;76.0;76.0;88.0;no;('Ungari', 7, 9, 'viisid', 13);Ungari;viisid
73324;Train/aja_luup200106_osa_2_ud211.conllu;Kuigi uus Tartu vangla mahutab 500 kinnipeetavat , lõpetab Euroopa Nõukogu tungival soovitusel oma tegevuse Tallinna Keskvangla .;59;74;Euroopa Nõukogu;bound;Kuigi uus Tartu vangla mahutab 500 kinnipeetavat , lõpetab tungival soovitusel oma tegevuse Tallinna Keskvangla .;100.0;100.0;100.0;no;('Euroopa', 9, 11, 'lõpetab', 9);Euroopa;lõpetab
72657;Train/aja_pm20001004_osa_4_ud211.conllu;USA välisminister Madelein Albright kohtub täna Pariisis Iisraeli peaministri Ehud Baraki ja palestiinlaste liidri Yasser Arafatiga , püüdes lõpetada Lähis-Idas taas puhkenud vägivalda .;93;107;palestiinlaste;bound;USA välisminister Madelein Albright kohtub täna Pariisis Iisraeli peaministri Ehud Baraki ja liidri Yasser Arafatiga , püüdes lõpetada Lähis-Idas taas puhkenud vägivalda .;95.7;95.7;100.0;no;('palestiinlaste', 12, 14, 'kohtub', 5);palestiinlaste;kohtub
73656;Train/aja_ee199920_osa_3_ud211.conllu;""" Kahjuks ma ei ole ise sinna vaatama jõudnud , kuigi mitu korda olen kavatsenud , "" ütleb EALi nõunik Hugo Alter .";91;95;EALi;bound;""" Kahjuks ma ei ole ise sinna vaatama jõudnud , kuigi mitu korda olen kavatsenud , "" ütleb nõunik Hugo Alter .";95.5;100.0;95.5;no;('EALi', 18, 20, 'ütleb', 18);EALi;ütleb
74510;Train/tea_toohoive.conllu;Võis oodata , et algab allakäiguspiraal : streigid palkade tõstmiseks , maksude tõus , tootmise kokkutõmbumine , tööpuuduse edasine kasv jne .;87;95;tootmise;bound;Võis oodata , et algab allakäiguspiraal : streigid palkade tõstmiseks , maksude tõus , kokkutõmbumine , tööpuuduse edasine kasv jne .;95.2;100.0;95.2;no;('tootmise', 14, 16, 'algab', 5);tootmise;algab
74638;Train/aja_ml200247_osa_2_ud211.conllu;Siin praegu õppivad eesti noored on saanud õppetoetust nii Sorose fondist , Avatud Eesti Fondist kui ka Briti valitsuselt .;83;88;Eesti;bound;Siin praegu õppivad eesti noored on saanud õppetoetust nii Sorose fondist , Avatud Fondist kui ka Briti valitsuselt .;84.2;94.7;84.2;no;('Eesti', 13, 15, 'saanud', 7);Eesti;saanud
74557;Train/aja_pm20000218_osa_5_ud211.conllu;Saksamaa Kristlik-Demokraatliku Liidu ( CDU ) liidri Wolfgang Schäuble tagasiastumine ärgitas hulgaliselt spekulatsioone selle kohta , kes tema mantlipärijana peaks hakkama CDUd päästma Helmut Kohli jäetud rahasegadustest .;9;31;Kristlik-Demokraatliku;bound;Saksamaa Liidu ( CDU ) liidri Wolfgang Schäuble tagasiastumine ärgitas hulgaliselt spekulatsioone selle kohta , kes tema mantlipärijana peaks hakkama CDUd päästma Helmut Kohli jäetud rahasegadustest .;100.0;100.0;100.0;no;('Kristlik-Demokraatliku', 1, 3, 'ärgitas', 11);Kristlik-Demokraatliku;ärgitas
72859;Train/aja_epl20061216_ud211.conllu;Selleks ajaks , kui ma lugema õppisin , oli vanem õde teose juba kapsaks lugenud , praeguseks on sellest köitest alles jäänud vaid tuhmunud ribad .;0;7;Selleks;bound;ajaks , kui ma lugema õppisin , oli vanem õde teose juba kapsaks lugenud , praeguseks on sellest köitest alles jäänud vaid tuhmunud ribad .;96.0;96.0;100.0;no;('Selleks', 0, 2, 'lugenud', 15);Selleks;lugenud
74056;Dev/aja_luup200009_ud211.conllu;“ Ühel kaptenite kursusel kasutati seda intsidenti kui näidet sellest , kuidas ei tohi teha , ” ütles mereväe suhtekorraldusülem .;102;109;mereväe;bound;“ Ühel kaptenite kursusel kasutati seda intsidenti kui näidet sellest , kuidas ei tohi teha , ” ütles suhtekorraldusülem .;75.0;80.0;85.0;no;('mereväe', 18, 20, 'ütles', 18);mereväe;ütles
72641;Train/aja_ee200110_osa_3_ud211.conllu;""" Tean Eestit just briljantse ja kuulsa astronoomi Ernst Öpiku kaudu , "" ütleb Havaii ülikooli astronoom David Jewitt , kes möödunud aastal avaldas ajakirjas Nature artikli meid taevast ähvardavatest ohtudest .";79;85;Havaii;bound;""" Tean Eestit just briljantse ja kuulsa astronoomi Ernst Öpiku kaudu , "" ütleb ülikooli astronoom David Jewitt , kes möödunud aastal avaldas ajakirjas Nature artikli meid taevast ähvardavatest ohtudest .";96.8;96.8;100.0;no;('Havaii', 14, 16, 'ütleb', 14);Havaii;ütleb
74648;Train/aja_ml200247_osa_3_ud211.conllu;Äsja vastu võetud seadus on esimene reaalne samm Euroopa Nõukogu Kohalike ja Regionaalsete Omavalitsuste Kongressi poolt Eesti kohaliku demokraatia arengu kohta 2000. aastal koostatud raporti soovituste elluviimisel .;49;64;Euroopa Nõukogu;bound;Äsja vastu võetud seadus on esimene reaalne samm Kohalike ja Regionaalsete Omavalitsuste Kongressi poolt Eesti kohaliku demokraatia arengu kohta 2000. aastal koostatud raporti soovituste elluviimisel .;80.8;92.3;88.5;no;('Euroopa', 8, 10, 'on', 5);Euroopa;on
73912;Train/tea_toohoive.conllu;Stabiilselt kõige madalam on aga töö leidmine riigi tööhõivetalituste kaudu .;33;36;töö;bound;Stabiilselt kõige madalam on aga leidmine riigi tööhõivetalituste kaudu .;90.0;90.0;90.0;no;('töö', 5, 7, 'on', 4);töö;on
73506;Train/tea_toohoive.conllu;Kapitali sissevool erinevatesse valdkondadesse on ebaühtlane .;0;8;Kapitali;bound;sissevool erinevatesse valdkondadesse on ebaühtlane .;100.0;100.0;100.0;no;('Kapitali', 0, 2, 'on', 5);Kapitali;on
73568;Train/aja_luup200202_osa_3_ud211.conllu;Põhjamaade mudel käsitleb terviseseisundit kajastavate isikuandmetega registrite rajamist ühiskonna huvina ning andmete saatmine registrisse ei eelda isiku nõusolekut .;129;140;registrisse;bound;Põhjamaade mudel käsitleb terviseseisundit kajastavate isikuandmetega registrite rajamist ühiskonna huvina ning andmete saatmine ei eelda isiku nõusolekut .;94.4;94.4;94.4;no;('registrisse', 13, 13, 'eelda', 16);registrisse;eelda
73858;Train/aja_luup200106_osa_6_ud211.conllu;Xerox pidas õnnestunult lahingu sõna “ xerox ” kasutamise vastu koopia sünonüümina kirjasõnas .;32;46;sõna “ xerox ”;bound;Xerox pidas õnnestunult lahingu kasutamise vastu koopia sünonüümina kirjasõnas .;60.0;60.0;80.0;no;('xerox', 6, 5, 'pidas', 2);xerox;pidas
73976;Train/tea_eesti_arst_2004_osa_2_ud211.conllu;Kõikide ladestunud amüloidi tüüpide koostisse kuuluvad alati lisaks fibrillidele glükoosaminoglükaanid ( GAG ) , samuti seondub fibrillidega seerumi amüloidi komponent P ( SAP ) .;141;157;seerumi amüloidi;bound;Kõikide ladestunud amüloidi tüüpide koostisse kuuluvad alati lisaks fibrillidele glükoosaminoglükaanid ( GAG ) , samuti seondub fibrillidega komponent P ( SAP ) .;87.0;91.3;91.3;no;('seerumi', 17, 19, 'seondub', 16);seerumi;seondub
73882;Train/tea_toohoive.conllu;Eestisse sisenenud kapitali jagunemist majandusagentide ( elanike , regioonide , majandusharude jm ) lõikes on raskem mõõta kui tootlikkust , eriti kui soovime madalama agregeerituse tasemega ( peenemaid ) andmeid .;39;100;majandusagentide ( elanike , regioonide , majandusharude jm );bound;Eestisse sisenenud kapitali jagunemist lõikes on raskem mõõta kui tootlikkust , eriti kui soovime madalama agregeerituse tasemega ( peenemaid ) andmeid .;86.4;86.4;100.0;no;('elanike', 6, 5, 'on', 15);elanike;on
73225;Train/tea_toohoive.conllu;Masinad võivad tööjõu tarvidust vähendada eelkõige olukorras , kus kogutootlikkuse paranemisest tulenevat toodangu mahtu ei saa mingitel põhjustel ( näiteks turgude kokkutõmbumine ) tugevasti suurendada , muidu suureneks tehnoloogia hooldajate arv sama palju või rohkemgi kui väheneb tehnoloogiaga asendatud töökohtade arv .;15;21;tööjõu;bound;Masinad võivad tarvidust vähendada eelkõige olukorras , kus kogutootlikkuse paranemisest tulenevat toodangu mahtu ei saa mingitel põhjustel ( näiteks turgude kokkutõmbumine ) tugevasti suurendada , muidu suureneks tehnoloogia hooldajate arv sama palju või rohkemgi kui väheneb tehnoloogiaga asendatud töökohtade arv .;97.6;100.0;97.6;no;('tööjõu', 2, 4, 'vähendada', 5);tööjõu;vähendada
73562;Train/ilu_valton_ud211.conllu;Ta nimetas koduloomi sõpradeks ja surus põse vastu hobuse kaela või hellitas kassi süles .;51;57;hobuse;bound;Ta nimetas koduloomi sõpradeks ja surus põse vastu kaela või hellitas kassi süles .;85.7;92.9;92.9;no;('hobuse', 8, 10, 'surus', 6);hobuse;surus
72415;Dev/tea_eesti_arst_2004_osa_1_ud211.conllu;Esimesel juhul esines 9. kromosoomi peritsentriline inversioon 77,3 % rakkudes , teisel juhul 41 % rakkudes .;94;98;41 %;bound;Esimesel juhul esines 9. kromosoomi peritsentriline inversioon 77,3 % rakkudes , teisel juhul rakkudes .;;;;no;('41', 13, 15, 'esines', 3);41;esines
73551;Train/tea_toohoive.conllu;"Nendeks allindikaatoriteks on : kapitali puhul : väliskapital töötaja kohta , väliskapital aktsiakapitali kohta ja väliskapitali tase ; ekspordi puhul : ekspordi osakaal kogu läbimüügis ( kui sünteetiline muutuja ) , eksport töötaja kohta ja eksport aktsiakapitali kohta ; kodumaise käibe puhul : kodumaine käive töötaja kohta ja kodumaine käive aktsiakapitali kohta .";170;185;kogu läbimüügis;bound;"Nendeks allindikaatoriteks on : kapitali puhul : väliskapital töötaja kohta , väliskapital aktsiakapitali kohta ja väliskapitali tase ; ekspordi puhul : ekspordi osakaal ( kui sünteetiline muutuja ) , eksport töötaja kohta ja eksport aktsiakapitali kohta ; kodumaise käibe puhul : kodumaine käive töötaja kohta ja kodumaine käive aktsiakapitali kohta .";76.5;76.5;94.1;no;('läbimüügis', 24, 23, 'on', 3);läbimüügis;on
74293;Train/tea_toohoive.conllu;Pärast 1996. a on osaajaga töö põhjendustes ( nii tööandja poolsetes põhjendustes kui ka inimeste endi soovis ) näha suuremat kõikuvust/varieeruvust .;18;26;osaajaga;bound;Pärast 1996. a on töö põhjendustes ( nii tööandja poolsetes põhjendustes kui ka inimeste endi soovis ) näha suuremat kõikuvust/varieeruvust .;90.5;90.5;95.2;no;('osaajaga', 4, 6, 'näha', 19);osaajaga;näha
74295;Train/tea_toohoive.conllu;Pärast 1996. a on osaajaga töö põhjendustes ( nii tööandja poolsetes põhjendustes kui ka inimeste endi soovis ) näha suuremat kõikuvust/varieeruvust .;89;102;inimeste endi;bound;Pärast 1996. a on osaajaga töö põhjendustes ( nii tööandja poolsetes põhjendustes kui ka soovis ) näha suuremat kõikuvust/varieeruvust .;90.0;90.0;95.0;no;('endi', 15, 15, 'näha', 19);endi;näha
73571;Train/aja_horisont2000_osa_5_ud211.conllu;Kuigi pealiskaudsel vaatlusel võib tunduda , et kehakelest rääkides teenitakse triviaalsusi korrates kerget raha , ei saa kehakeele valdamist siiski alahinnata .;122;131;kehakeele;bound;Kuigi pealiskaudsel vaatlusel võib tunduda , et kehakelest rääkides teenitakse triviaalsusi korrates kerget raha , ei saa valdamist siiski alahinnata .;100.0;100.0;100.0;no;('kehakeele', 17, 19, 'alahinnata', 21);kehakeele;alahinnata
72843;Train/aja_ee199920_osa_2_ud211.conllu;Üks neist institutsioonidest , kes on oma usaldusväärsust tõestanud , tuleks panna Hüvitusfondi järelevalvajaks .;4;69;neist institutsioonidest , kes on oma usaldusväärsust tõestanud ,;bound;Üks tuleks panna Hüvitusfondi järelevalvajaks .;100.0;100.0;100.0;no;('institutsioonidest', 2, 1, 'panna', 12);institutsioonidest;panna
73970;Train/tea_eesti_arst_2004_osa_2_ud211.conllu;Ka tselluliit ja liigliha kasv epitsüstoomi ava ümbruses ei ole harv tüsistus .;31;56;epitsüstoomi ava ümbruses;bound;Ka tselluliit ja liigliha kasv ei ole harv tüsistus .;100.0;100.0;100.0;no;('ümbruses', 7, 5, 'ei', 9);ümbruses;ei
72540;Train/aja_ee200110_osa_10_ud211.conllu;Samas on see ikka seesama ATS , kes kümmekond aastat tagasi , ketid kaelas ja sigaret sõrmede vahel , Tallinna tänavail uitas .;86;99;sõrmede vahel;bound;Samas on see ikka seesama ATS , kes kümmekond aastat tagasi , ketid kaelas ja sigaret , Tallinna tänavail uitas .;90.5;95.2;95.2;no;('sõrmede', 16, 16, 'uitas', 22);sõrmede;uitas
73016;Train/aja_ee200110_osa_9_ud211.conllu;Ilusad asjad on üldine aja märk .;23;26;aja;bound;Ilusad asjad on üldine märk .;100.0;100.0;100.0;no;('aja', 4, 6, 'on', 3);aja;on
73349;Train/aja_ee199920_osa_3_ud211.conllu;Lisaajaks ei jätkunud püssirohtu , mänguniite tõmbasid Hlinka hoolealused .;55;61;Hlinka;bound;Lisaajaks ei jätkunud püssirohtu , mänguniite tõmbasid hoolealused .;88.9;100.0;88.9;no;('Hlinka', 7, 9, 'tõmbasid', 7);Hlinka;tõmbasid
72555;Train/aja_pm20000218_osa_5_ud211.conllu;Weyrauch aga on isikuks , kelle kaudu käis tõenäoliselt suur osa kahtlastest rahaliikumistest .;65;93;kahtlastest rahaliikumistest;bound;Weyrauch aga on isikuks , kelle kaudu käis tõenäoliselt suur osa .;91.7;100.0;91.7;no;('rahaliikumistest', 12, 11, 'käis', 8);rahaliikumistest;käis
73412;Train/aja_sloleht20071217_ud211.conllu;Ragnar Klavani koduklubi Almelo Heracles sai Hollandi meistriliigas jälle kaotuse , kui jäi 0 : 3 alla FC Utrechtile .;45;53;Hollandi;bound;Ragnar Klavani koduklubi Almelo Heracles sai meistriliigas jälle kaotuse , kui jäi 0 : 3 alla FC Utrechtile .;94.7;94.7;94.7;no;('Hollandi', 6, 8, 'sai', 6);Hollandi;sai
73340;Dev/tea_eesti_arst_2004_osa_1_ud211.conllu;Olemata spetsialist turunduse ja reklaami alal , olen veendunud , et ravimireklaam ei toimi samadel põhimõtetel nagu näiteks pesupulbri reklaam - olgu pidevalt silmade ees , vedelegu või põrandal .;20;41;turunduse ja reklaami;bound;Olemata spetsialist alal , olen veendunud , et ravimireklaam ei toimi samadel põhimõtetel nagu näiteks pesupulbri reklaam - olgu pidevalt silmade ees , vedelegu või põrandal .;74.1;81.5;77.8;no;('reklaami', 4, 3, 'Olemata', 1);reklaami;Olemata
74571;Train/aja_ee199920_osa_2_ud211.conllu;Neid finantsstabiilsuse allikaid pole raske nimetada : Eesti Pank , Hansapank , pärast rootslaste kätte minekut ka Ühispank ning loodetavasti saab selleks , pärast Aare Järvani asumist kantsleri kohale , ka rahandusministeerium .;185;194;kantsleri;bound;Neid finantsstabiilsuse allikaid pole raske nimetada : Eesti Pank , Hansapank , pärast rootslaste kätte minekut ka Ühispank ning loodetavasti saab selleks , pärast Aare Järvani asumist kohale , ka rahandusministeerium .;78.1;81.2;84.4;no;('kantsleri', 27, 29, 'saab', 21);kantsleri;saab
